益民创新优势混合,银华沪深300指数(LOF),华安中国A股增强指数,东吴中证新兴指数,嘉实研究阿尔法股票,信达澳银领先增长混合,博时沪深300指数A,鹏华信用增利债券B,鹏华信用增利债券A,国富沪深300指数增强,工银绝对收益混合发起B,华泰柏瑞量化优选混合,兴全沪深300指数(LOF)A,华泰柏瑞量化驱动混合A,平安鑫享混合C,平安鑫享混合A,南方大数据300A,南方大数据300C,景顺长城领先回报混合A,嘉实事件驱动股票,富国绝对收益多策略混合A,景顺长城优质成长股票,华泰柏瑞量化绝对收益混合,上投摩根动态多因子混合,创金合信沪深300指数增强C,创金合信沪深300指数增强A,景顺长城领先回报混合C,万家沪深300指数增强A,财通资管积极收益债券A,广发百发大数据精选混合A,财通资管积极收益债券C,招商沪深300指数增强A,建信鑫荣回报灵活配置混合,大成核心双动力混合,德邦量化优选股票(LOF)C,创金合信量化核心混合C,前海开源嘉鑫混合A,工银新机遇灵活配置混合A,富国沪深300指数增强A,嘉实绝对收益策略定期混合A,工银新价值灵活配置混合A,博时量化平衡混合,富国天惠成长混合A/B(LOF),创金合信量化核心混合A,德邦量化优选股票(LOF)A,信诚多策略灵活配置混合,富国天惠成长混合C,信诚量化阿尔法股票A,前海开源嘉鑫混合C,国投瑞银中证消费服务指数,建信鑫利回报灵活配置混合A,景顺长城量化平衡混合,建信量化事件驱动股票,建信鑫泽回报灵活配置混合C,上投摩根优选多因子股票,前海开源沪港深景气行业精选混合,华泰柏瑞量化阿尔法A,万家量化睿选混合,富国宝利增强债券,建信鑫利回报灵活配置混合C,工银新机遇灵活配置混合C,上投摩根量化多因子混合,博时量化多策略股票C,博时沪深300指数C,博时量化多策略股票A,广发百发大数据精选混合E,财通中证ESG100指数增强A,浦银安盛量化多策略混合A,万家沪深300指数增强C,博时量化价值股票A,博道启航混合C,景顺长城量化先锋混合,德邦民裕进取量化混合C,财通资管积极收益债券E,平安MSCI中国A股ETF,财通量化核心优选混合,安信量化优选股票A,建信鑫泽回报灵活配置混合A,博时量化价值股票C,德邦民裕进取量化混合A,财通鑫盛6个月定开,景顺长城MSCI中国A股国际通,浦银安盛量化多策略混合C,长城久泰沪深300指数A,安信量化优选股票C,博道启航混合A,大摩量化配置混合A,华泰柏瑞量化增强混合A,华泰柏瑞量化对冲,中金绝对收益,招商沪深300指数增强C,工银绝对收益混合发起A,财通中证ESG100指数增强C
诺德灵活配置混合,中银消费主题混合,万家中证红利指数(LOF),信诚深度价值混合(LOF),东吴新经济混合A,华夏医药ETF,华泰柏瑞上证红利ETF,国联安红利混合,天治趋势精选混合,泰信行业精选混合A,博时上证自然资源ETF,新华中小市值优选混合,大摩消费领航混合,招商上证消费80ETF,国联安上证商品ETF,农银高增长混合,诺安新动力灵活配置混合A,农银行业领先混合,建信恒稳价值混合,金元顺安宝石动力混合,国投瑞银瑞源灵活配置混合,平安策略先锋混合,兴全绿色投资混合(LOF),农银行业轮动混合,浦银安盛红利精选混合A,长城双动力混合,中银中小盘成长混合,长城稳健成长灵活配置混合,国投瑞银中证资源指数,中银美丽中国混合,上投摩根健康品质生活混合,中海蓝筹混合,鹏华中证A股资源产业指数(LOF)A,诺安策略精选股票,华夏希望债券C,汇丰晋信中小盘股票,万家双引擎灵活配置混合,农银平衡双利混合,国富成长动力混合,农银策略精选混合,前海开源事件驱动混合A,东吴阿尔法灵活配置混合A,东方多策略灵活配置混合A,中海积极收益混合,长盛城镇化主题混合,民生加银精选混合,长城久鑫灵活配置,广发逆向策略混合A,泰达宏利领先中小盘混合,招商丰盛稳定增长混合A,长安产业精选混合A,工银研究精选股票,银河灵活配置混合C,国投瑞银信息消费混合,农银医疗保健股票,广发信息技术联接A,平安新鑫先锋A,长城久恒灵活配置混合,建信睿盈灵活配置混合A,建信潜力新蓝筹股票,博时上证超大盘ETF,易方达裕如混合,国投瑞银新丝路混合(LOF),新华中证环保产业指数,浙商汇金转型成长,博时鑫泰混合C,中融国企改革混合,华富智慧城市灵活配置混合,创金合信沪港深精选混合,中海积极增利混合,天弘中证计算机ETF联接A,天弘中证计算机ETF联接C,华安中证银行指数,兴银鼎新灵活配置混合,英大灵活配置混合型发起式B,德邦福鑫灵活配置混合A,安信中证一带一路主题指数,中融中证煤炭指数(LOF),大成正向回报灵活配置混合,华富国泰民安灵活配置混合,长城久惠灵活配置混合,上投摩根新兴服务股票,鑫元鑫新收益灵活配置混合A,鹏华中证医药卫生(LOF)A,西部利得多策略优选混合,前海开源强势共识100强股票,前海开源优势蓝筹股票C,中融新机遇混合,南方中证高铁产业指数(LOF),泰达宏利蓝筹混合,鹏华中证高铁产业指数(LOF),中邮趋势精选灵活配置混合,建信消费升级混合,金鹰红利价值混合,中海优势精选灵活配置混合,长城新兴产业混合,农银工业4.0混合,农银消费主题混合A,安信合作创新灵活配置混合,农银主题轮动混合,中邮稳健添利灵活配置混合,中海进取收益混合,富国研究优选沪港深混合,浦银安盛睿智精选混合A,中邮低碳配置混合,工银物流产业股票,农银新能源主题,前海开源事件驱动混合C,泰信行业精选混合C,中海顺鑫灵活配置混合,博时工业4.0主题股票,长城新优选混合A,前海开源沪港深龙头精选混合,德邦福鑫灵活配置混合C,诺安景鑫灵活配置混合,英大策略优选A,英大策略优选C,华宝核心优势混合,华夏消费ETF,华夏希望债券A,金信转型创新成长混合发起式,建信弘利灵活配置混合,中邮新思路灵活配置混合,东吴移动互联混合A,中海魅力长三角混合,浦银安盛睿智精选混合C,南方中证500信息技术联接A,汇添富中证上海国企ETF,长城新优选混合C,招商丰利灵活配置混合C,诺安利鑫灵活配置混合A,浦银安盛消费升级混合C,东吴智慧医疗量化混合A,前海开源恒远灵活配置混合,农银汇理国企改革混合,博时睿利事件驱动(LOF),建信兴利灵活配置混合,广发百发大数据成长混合A,华夏新起点混合A,广发百发大数据成长混合E,招商增荣混合(LOF),招商丰盛稳定增长混合C,上投摩根文体休闲灵活配置混合,建信丰裕多策略混合(LOF),浦银安盛消费升级混合A,华商新动力混合,金信量化精选混合,大成动态量化混合,中邮核心成长混合,嘉实物流产业股票C,嘉实惠泽混合(LOF),国投瑞银瑞利混合(LOF),信诚至利混合C,南方医药保健灵活配置混合,长安产业精选混合C,银华鑫盛灵活配置混合(LOF)A,招商丰利灵活配置混合A,中国梦灵活配置混合,招商沪深300高贝塔,银河灵活配置混合A,前海开源沪港深大消费混合A,长信创新驱动股票,金鹰鑫益混合A,金元顺安成长动力混合,前海开源沪港深大消费混合C,农银策略价值混合,华宝转型升级混合,九泰锐丰灵活配置混合(LOF)A,富国睿利定开混合发起式,工银国家战略股票,信诚至利混合A,中融中证银行指数(LOF),金鹰鑫益混合C,景顺长城低碳科技主题混合,海富通沪港深灵活配置混合,大成景尚灵活配置混合A,招商沪港深科技创新混合A,汇安丰华混合C,前海开源沪港深乐享生活,富国中证娱乐主题指数增强(LOF)A,信诚新悦回报灵活配置混合B,信诚新悦回报灵活配置混合A,华夏行业景气混合,财通福盛混合发起(LOF)A,平安鑫利混合A,新华外延增长主题灵活配置混合,东海祥龙混合(LOF),汇丰晋信2026周期混合,英大睿鑫C,东方周期优选灵活配置混合,汇安丰华混合A,建信中国制造2025股票A,长城中国智造灵活配置混合A,农银区间收益混合,诺德成长精选C,诺德成长精选A,前海开源周期优选混合A,博时鑫泰混合A,信达澳银新财富混合,前海开源周期优选混合C,山西策略灵活配置混合,泰康沪港深价值优选混合,农银研究精选混合,富安达策略精选混合,前海开源优势蓝筹股票A,金信深圳成长混合发起式,富安达新动力混合,建信睿盈灵活配置混合C,英大睿鑫A,泰康金泰3月定开混合,大成智惠量化多策略混合,万家宏观择时多策略混合,中融物联网主题灵活配置混合,安信中国制造2025混合,中邮医药健康混合,新华鑫泰灵活配置混合,东方支柱产业灵活配置混合,中邮战略新兴产业混合,长盛创新先锋混合A,国投瑞银瑞盈混合(LOF),农银尖端科技混合,汇安丰裕灵活配置混合A,嘉实物流产业股票A,农银中小盘混合,宝盈国家安全沪港深股票A,前海开源沪港深创新成长混合C,圆信永丰兴源灵活配置混合C,南方有色金属ETF联接A,易方达中证全指证券公司ETF,国投瑞银招财混合,圆信永丰兴源灵活配置混合A,中银健康生活混合,英大灵活配置混合型发起式A,汇添富中证互联网医疗指数A,前海开源沪港深创新成长混合A,中邮风格轮动灵活配置混合,大成一带一路灵活配置混合,富安达健康人生混合A,前海开源量化优选A,申万菱信量化成长混合,信诚新泽B,信诚新泽A,汇安丰裕灵活配置混合C,农银中国优势灵活配置混合,平安转型创新混合C,博时文体娱乐主题混合,招商优势企业混合,创金合信优选回报灵活配置混合,鑫元欣享灵活配置混合C,金信价值精选混合A,华泰柏瑞富利混合A,中银改革红利灵活配置混合,汇添富全球医疗混合美元现钞,富国国企改革灵活配置混合,博时创新驱动混合C,东方红目标优选定开混合,鑫元欣享灵活配置混合A,华商改革创新股票,银华永祥灵活配置混合,诺安改革趋势灵活配置混合,汇添富行业整合混合,中融核心成长,金信价值精选混合C,汇添富中证互联网医疗指数C,华宝价值发现混合,光大多策略优选定开混合,汇添富全球医疗混合美元现汇,人保研究精选混合A,泰康睿利量化多策略混合A,银华医疗健康量化优选C,华宝未来主导混合A,富安达消费主题混合,嘉实新添辉定期混合C,鑫元鑫新收益灵活配置混合C,中邮未来新蓝筹混合,大摩万众创新混合A,东吴移动互联混合C,建信裕利灵活配置混合,东方阿尔法精选混合A,华泰柏瑞新金融地产混合,平安鼎泰混合(LOF),富国新优享灵活配置混合C,富国新优享灵活配置混合A,信诚鼎利,银河文体娱乐混合,工银沪港深精选混合A,工银沪港深精选混合C,汇添富民安增益定开混合A,中欧睿达定期开放混合A,银河鑫月享定开混合A,银河鑫月享定开混合C,嘉实新添辉定期混合A,博时创新驱动混合A,银华医疗健康量化优选A,申万菱信行业轮动股票,广发新兴成长混合,汇添富全球医疗混合人民币,鑫元价值精选混合A,鑫元价值精选混合C,人保研究精选混合C,人保转型新动力混合C,万家智造优势混合C,中信保诚至兴混合A,大成景恒混合A,金信智能中国2025混合,万家新机遇龙头企业混合A,前海联合润丰混合A,浦银安恒回报定开混合A,西部利得景程混合C,创金合信红利低波动C,泰达睿智稳健混合A,红土创新新科技股票,农银汇理睿选灵活配置混合,华夏新时代混合人民币(QDII),建信汇利灵活配置混合,国联安价值优选股票,创金合信红利低波动A,兴全轻资产混合(LOF),国联安远见成长混合,中加转型动力混合C,西部利得景程混合A,前海联合润丰混合C,合煦智远嘉选混合A,合煦智远嘉选混合C,东方阿尔法精选混合C,中加改革红利混合,人保量化混合A,中信保诚至兴混合C,人保转型新动力混合A,诺德消费升级混合,农银汇理量化智慧动力混合,中邮核心优选混合,人保量化混合C,平安鑫利混合C,招商体育文化休闲股票,汇丰晋信珠三角区域发展混合,西部利得国企红利(LOF)A,鹏华研究驱动混合,浦银安恒回报定开混合C,宝盈优势产业混合A,华宝绿色主题混合A,中加转型动力混合A,广发龙头优选混合,万家智造优势混合A,前海开源量化优选C,建信新经济灵活配置混合,信达澳银消费优选混合,汇添富民安增益定开混合C,平安新鑫先锋C,富国沪港深业绩驱动混合型A,大成景恒混合C,大成国企改革灵活配置混合,东方多策略灵活配置混合C,信达澳银中小盘混合,申万菱信竞争优势混合,农银行业成长混合,平安转型创新混合A,东吴配置优化混合A,国投瑞银创新医疗混合,安信鑫发优选混合A,大成景尚灵活配置混合C,长城优化升级混合A,泰康睿利量化多策略混合C,金鹰多元策略混合
嘉实深证基本面120ETF,银华深证100指数(LOF),招商深证100指数A,建信深证100指数增强,嘉实深证基本面120联接A,融通深证成份指数A,华夏中小企业100ETF,广发中小企业300ETF,广发深证100指数(LOF)A,广发成长优选混合,华富中小企业100指数增强,大成深证成份ETF,汇添富深证300ETF,国投瑞银深证100指数,平安深证300指数增强,易方达深证100ETF,国联安中小综指(LOF),南方深证成份ETF联接A,南方深证成份ETF,大摩深证300指数增强,汇添富深证300ETF联接,广发中小企业300ETF联接A,易方达中小企业100(LOF)A,中融鑫思路混合C,中融鑫思路混合A,招商深证100指数C,融通深证100指数A,申万菱信深证成份指数(LOF),融通深证成份指数C,融通深证100指数C,易方达深证100ETF联接A,申万菱信中小企业100指数(LOF)A
中信保诚中证500指数(LOF)A,广发中证500ETF,农银中证500指数,嘉实中证500ETF联接A,鹏华中证500指数(LOF)A,大成中证500深市ETF,广发中证500ETF联接A,天弘中证500ETF联接A,景顺长城中证500ETF,景顺长城中证500ETF联接,华泰柏瑞中证500ETF,国寿安保中证500ETF,易方达中证500ETF,嘉实中证500ETF,南方中证500ETF,华夏中证500ETF,华富华鑫灵活配置混合A,南方中证500ETF联接A,汇添富中证500C,汇添富中证500A,鹏华睿投混合,平安中证500ETF,华富华鑫灵活配置混合C
东吴进取策略混合A,国联安安心成长混合,天治研究驱动混合A,中邮核心主题混合,兴全精选混合,华商产业升级混合,汇丰晋信龙腾混合,汇丰晋信科技先锋股票,金鹰灵活配置混合A,金鹰灵活配置混合C,景顺长城研究精选股票,广发聚祥灵活混合,国联安新精选混合,汇丰晋信双核策略混合C,华宝品质生活股票,景顺长城支柱产业混合,海富通强化回报混合,上投摩根卓越制造股票,嘉实中证主要消费ETF,中邮核心科技创新灵活配置混合,宝盈睿丰创新混合A/B,汇丰晋信双核策略混合A,鹏华弘泽混合C,前海开源金银珠宝混合A,华宝万物互联混合,鹏华弘泽混合A,诺安创新驱动混合A,长盛新兴成长混合,诺安中证500指数增强A,北信瑞丰新成长,融通跨界成长灵活配置混合,招商丰泰混合(LOF),汇丰晋信智造先锋股票C,长盛中证申万一带一路指数(LOF),中融鑫起点混合A,前海开源大安全混合,富国中证煤炭指数(LOF)A,华安新优选灵活配置混合A,上投摩根科技前沿灵活配置混合,浙商汇金转型驱动,汇丰晋信消费红利股票,长盛战略新兴产业混合C,宝盈睿丰创新混合C,民生加银新动力混合A,金元顺安优质精选混合C,汇添富优选回报灵活配置混合A,前海开源一带一路混合C,兴业聚源混合A,博时颐泰混合C,嘉实新优选混合,广发稳裕混合A,新华积极价值灵活配置混合,南方荣光C,南方瑞利灵活配置混合,博时颐泰混合A,中银益利混合C,广发安宏回报混合A,诺安创新驱动混合C,招商康泰灵活配置混合,天治研究驱动混合C,安信新目标混合A,博时鑫泽灵活配置混合A,嘉实新财富混合,汇丰晋信沪港深A,汇丰晋信沪港深C,安信新目标混合C,华安智增精选混合,中融竞争优势,海富通领先成长混合,财通多策略福瑞混合发起式(LOF)A,博时鑫泽灵活配置混合C,长盛战略新兴产业混合A,广发安宏回报混合C,国联安锐意成长混合,中金量化多策略混合,华泰保兴吉年丰混合发起A,长盛盛崇灵活配置混合A,鹏华安益增强混合,华宝宝康配置混合,中银量化精选混合A,中邮景泰灵活配置混合A,长盛盛崇灵活配置混合C,中银锦利灵活配置混合C,上投安丰回报C,上投安丰回报A,中银品质生活混合,万家瑞富灵活配置混合A,浦银安盛经济带崛起混合,华泰保兴吉年丰混合发起C,汇丰晋信低碳先锋股票A,上投摩根智选30混合,中银锦利灵活配置混合A,天弘策略精选混合A,长盛沪港深混合,信诚幸福消费混合,长盛生态环境混合,博时汇智回报灵活配置混合,诺安高端制造股票A,北信瑞丰健康生活,天弘策略精选混合C,华泰柏瑞精选回报混合,前海开源金银珠宝混合C,银河量化优选混合,中银益利混合A,上投摩根安通回报混合C,上投摩根安通回报混合A,银华万物互联灵活配置混合,鹏华弘安混合A,新华红利回报混合,华安新优选灵活配置混合C,泰康泉林量化价值精选混合C,银华稳健增利灵活配置混合A,华夏永康添福混合,汇添富添福吉祥混合,南华瑞盈混合发起C,南方全天候策略(FOF)C,金元顺安优质精选混合A,财通资管鑫锐混合A,南华丰淳混合A,南华瑞盈混合发起A,中金金泽A,南方全天候策略(FOF)A,华商新兴活力混合,财通资管鑫锐混合C,华泰保兴吉年福定开混合,广发价值回报混合C,国泰量化成长优选混合C,中金金泽C,银华稳健增利灵活配置混合C,北信瑞丰兴瑞灵配,南华丰淳混合C,汇添富盈润混合A,华泰保兴成长优选A,鹏华弘安混合C,广发再融资主题(LOF)A,鹏扬景兴混合C,中金衡优灵活配置混合C,泰康泉林量化价值精选混合A,汇丰晋信大盘股票A,华泰保兴成长优选C,民生加银量化中国混合,前海开源价值成长混合A,银华混改红利灵活配置混合发起式,长信量化价值驱动混合A,华夏优势精选股票,西部利得新富混合,光大银发商机混合,中金衡优灵活配置混合A,前海开源价值成长混合C,鹏扬景兴混合A,广发价值回报混合A,汇丰晋信新动力混合,汇丰晋信智造先锋股票A,国泰量化成长优选混合A,鹏华沪深港新兴成长混合,汇添富优选回报灵活配置混合C,前海开源一带一路混合A,汇添富盈润混合C,南方荣光A,中融鑫起点混合C,中邮景泰灵活配置混合C,嘉实新起航混合
易方达策略成长混合,国富焦点驱动混合,易方达价值精选混合,易方达优质精选混合(QDII),易方达科汇灵活配置混合,易方达科翔混合,易方达平稳增长混合,易方达上证50增强A,易方达资源行业混合,国富弹性市值混合,国富潜力组合混合A,国富深化价值混合,国富健康优质生活股票,易方达安心回馈混合,易方达创新驱动灵活配置混合,易方达科讯混合,易方达国企改革混合,易方达策略成长二号混合,易方达瑞享混合E,易方达沪深300非银ETF,易方达中证万得并购重组(LOF),易方达新鑫混合E,易方达新鑫混合I,易方达国防军工混合,易方达改革红利混合,易方达新利灵活配置混合,易方达新常态灵活配置混合,易方达瑞享混合I,易方达沪深300医药ETF,易方达新兴成长灵活配置,易方达新享混合A,易方达新享混合C,易方达新益混合I,易方达新益混合E,国富新机遇混合A,易方达瑞财混合I,易方达瑞财混合E,国富沪港深成长精选股票,易方达瑞选灵活配置混合E,易方达瑞选灵活配置混合I,易方达新丝路灵活配置混合,易方达瑞兴灵活配置混合E,国富策略回报混合,易方达瑞智灵活配置混合I,易方达消费行业股票,易方达信息产业混合,易方达新收益混合A,易方达裕惠定开混合发起式,国富大中华精选混合,易方达科瑞混合,易方达瑞弘混合A,易方达瑞弘混合C,易方达瑞程灵活配置混合A,易方达供给改革混合,国富中国收益混合,易方达安盈回报混合,易方达瑞通灵活配置混合A,易方达瑞通灵活配置混合C,易方达上证50增强C,国富新机遇混合C,易方达瑞智灵活配置混合E,易方达行业领先混合,易方达积极成长混合,易方达瑞富灵活配置混合I,易方达丰惠混合,易方达瑞富灵活配置混合E,国富中小盘股票,易方达瑞兴灵活配置混合I,易方达新经济混合,易方达瑞景混合,易方达环保主题混合,易方达瑞祺灵活配置混合E,易方达瑞恒灵活配置混合,易方达量化策略A,易方达瑞祥灵活配置混合E,国富新趋势混合A,国富新趋势混合C,易方达瑞祺灵活配置混合I,易方达瑞信混合E,国富天颐混合A,易方达中证万得生物科技指数(LOF)A,易方达瑞和灵活配置混合,易方达瑞祥灵活配置混合I,易方达现代服务业混合,国富天颐混合C,易方达量化策略C,易方达瑞信混合I,易方达中盘成长混合,易方达价值成长混合,易方达大健康混合,易方达医疗保健行业混合,易方达蓝筹精选混合,国富估值优势混合,易方达中证银行指数(LOF)A,易方达新收益混合C,易方达中证全指证券公司指数(LOF)A,易方达瑞程灵活配置混合C,国富研究精选混合
海富通安颐收益混合A,海富通新内需混合C,海富通安颐收益混合C,海富通欣益混合C,海富通欣益混合A,海富通新内需混合A,海富通欣荣混合C,海富通欣荣混合A,海富通欣享灵活配置混合C,海富通欣享灵活配置混合A,海富通稳固收益债券,海富通量化多因子混合C,海富通量化多因子混合A,海富通阿尔法对冲混合A,海富通富祥混合
泰达宏利逆向策略混合,泰达宏利宏达混合B,泰达改革动力混合A,泰达宏利宏达混合A,泰达改革动力混合C,泰达宏利风险预算混合
融通创业板指数A,易方达创业板ETF联接A,易方达创业板ETF,华安创业板50指数,天弘创业板ETF联接基金C,南方创业板ETF,博时创业板ETF,国泰创业板指数(LOF),广发创业板ETF,嘉实创业板ETF,广发创业板ETF联接A,工银瑞信创业板ETF,华安创业板50ETF,建信创业板ETF,海富通创业板增强A,华夏创业板ETF,南方创业板ETF联接A,海富通创业板增强C,富国创业板指数(LOF)A,融通创业板指数C,天弘创业板ETF联接基金A,鹏华创业板指数(LOF)
信达澳银精华配置混合A,前海开源中国成长混合,信诚中证TMT产业主题指数(LOF)A,广发中证全指信息技术ETF,天弘中证电子ETF联接A,南方中证互联网指数(LOF),鹏华中证移动互联网指数(LOF),农银信息传媒股票,申万中证申万电子行业投资指数(LOF)A,信达澳银新能源产业股票,景顺中证科技传媒通信150ETF,富国中证移动互联网指数(LOF)A,富国中证高端制造指数增强型,银华信息科技量化股票发起式C,易方达易百智能量化策略A,银华信息科技量化股票发起式A,易方达易百智能量化策略C,鹏华信息A,天弘中证电子ETF联接C
