广发大盘成长混合,广发行业领先混合A,广发制造业精选混合A,鹏华新兴产业混合,大成深证成长40ETF,招商深证TMT50ETF,国泰金鼎价值混合,华宝资源优选混合A,中银持续增长混合A,嘉实服务增值行业混合,宝盈泛沿海增长混合,民生加银景气行业混合A,景顺长城能源基建混合,景顺长城中小盘混合,广发聚富混合,融通新蓝筹混合,诺德成长优势混合,景顺长城品质投资混合,大成价值增长混合,大成内需增长混合A,大成消费主题混合,大成新锐产业混合,银河消费混合,新华优选分红混合,大摩卓越成长混合,融通医疗保健行业混合A/B,民生加银红利回报混合,财通可持续混合,诺安主题精选混合,广发消费品精选混合A,国泰区位优势混合,建信优化配置混合,国联安中证医药100A,景顺长城内需增长混合,嘉实领先成长混合,国泰国证房地产行业指数,富安达优势成长混合,中银蓝筹混合,大成优选混合(LOF),景顺长城内需贰号混合,光大行业轮动混合,融通行业景气混合A,广发轮动配置混合,国泰金牛创新成长混合,广发聚优灵活配置混合A,国泰价值经典混合(LOF),天弘文化新兴产业,光大中小盘混合,诺安先锋混合A,嘉实回报混合,华宝宝康消费品,华宝动力组合,广发新经济混合A,鹏华普天收益混合,嘉实成长收益混合A,嘉实增长混合,鹏华优质治理混合(LOF),嘉实策略混合,宝盈策略增长混合,长信金利趋势混合,海富通精选混合,国泰浓益灵活配置混合A,广发竞争优势混合A,东方新兴成长混合,银河定投宝腾讯济安指数,银河美丽混合C,国泰国证医药卫生行业指数,广发新动力混合,广发小盘成长混合(LOF)A,华宝生态中国混合,国泰聚信价值优势混合A,国泰聚信价值优势混合C,嘉实新兴产业股票,广发趋势优选灵活配置混合A,博时卓越品牌混合(LOF),信诚中证800医药指数(LOF)A,华安动态灵活配置混合A,银河康乐股票,宝盈新价值混合A,融通健康产业灵活配置混合A/B,嘉实企业变革股票,景顺长城量化精选股票,天弘云端生活优选,景顺长城优势企业混合,大成产业升级股票(LOF),东吴嘉禾优势精选混合,华宝服务优选混合,华泰柏瑞积极优选股票,嘉实逆向策略股票,华夏医疗健康混合A,华夏医疗健康混合C,新华策略精选股票,万家新利灵活配置混合,华夏大盘精选混合A,嘉实泰和混合,景顺长城公司治理混合,中银新动力股票,安信消费医药股票,东方主题精选混合,广发主题领先混合,嘉实新收益混合,广发聚安混合C,中欧瑾和灵活配置混合C,招商沪深300地产等权重指数A,华宝国策导向混合,天弘中证食品饮料ETF联接A,大摩主题优选混合,华泰柏瑞消费成长混合,新华行业灵活配置混合C,前海开源沪港深蓝筹精选混合A,浙商聚潮产业成长混合A,万家行业优选混合(LOF),鹏华医药科技,九泰锐智事件驱动混合(LOF),国泰金鑫股票,招商国企改革主题混合基金,天弘医疗健康混合C,广发中证医疗指数(LOF)A,中欧瑾和灵活配置混合A,国泰央企改革股票,光大优势配置混合,大成睿景灵活配置混合A,东方新思路混合A,东方新思路混合C,光大鼎鑫混合A,银河服务混合,天弘医疗健康混合A,前海开源中国稀缺资产混合A,金鹰产业整合混合,嘉实主题混合,安信动态策略混合A,信诚新选混合A,大成睿景灵活配置混合C,建信互联网+产业升级股票,广发养老指数A,博时中证全指证券公司指数(LOF),前海开源工业革命4.0混合,信诚新锐混合A,招商中证白酒指数(LOF)A,长盛养老健康产业灵活配置混合,国泰国证食品饮料行业(LOF),中邮创新优势灵活配置混合,申万菱信消费增长混合,华宝医药生物混合,华夏经典混合,前海开源大海洋混合,国泰金马稳健混合,华宝创新优选混合,景顺长城核心竞争力混合A,财通成长优选混合,国泰睿吉灵活配置混合A,前海开源沪港深农业混合,天弘中证医药100A,天弘中证医药100C,鹏华外延成长混合,招商中证煤炭等权指数(LOF)A,嘉实沪港深精选股票,中欧消费主题股票C,兴业聚宝灵活配置混合,国泰浓益灵活配置混合C,银华成长先锋混合,光大红利混合,招商安博灵活配置混合A,嘉实医疗保健股票,海富通精选贰号混合,万家精选混合,招商制造业混合A,广发多策略混合,申万菱信中证500指数增强A,泰信中小盘精选混合,大摩健康产业混合A,诺安精选回报混合,华泰柏瑞新利混合C,九泰久盛量化先锋混合A,鹏华健康环保混合,天弘永定价值成长混合,景顺长城策略精选灵活配置混合,信诚新选混合B,融通蓝筹成长混合,金鹰科技创新股票,光大睿鑫混合A,广发鑫享混合,银华沪港深增长股票A,光大睿鑫混合C,嘉实创新成长混合,安信价值精选股票,华夏军工安全混合A,广发聚宝混合A,信诚中证800有色指数(LOF)A,浙商大数据智选消费混合,泓德远见回报混合,国泰民益混合(LOF)A,光大鼎鑫混合C,兴业聚鑫灵活配置混合A,长盛互联网+混合,国泰金泰灵活配置混合C,国泰民益混合(LOF)C,前海开源人工智能主题混合,融通成长30灵活配置混合A,景顺长城环保优势股票,广发鑫裕混合A,大成多策略混合(LOF),兴业聚丰混合A,招商安博灵活配置混合C,信诚新锐混合B,景顺长城沪港深精选股票,诺安安鑫灵活配置混合,前海开源沪港深优势精选混合A,银华回报定开混合,国泰金鹰增长混合,中欧医疗健康混合C,光大国企改革股票,招商优质成长混合(LOF),中欧医疗健康混合A,兴业聚盈混合A,财通价值动量混合,华夏成长混合,国泰国证有色金属行业指数(LOF),新华钻石品质企业混合,国泰中证全指证券公司ETF,华夏行业混合(LOF),融通通乾研究精选混合,招商丰凯混合C,招商丰凯混合A,信诚至裕灵活配置混合A,大成景禄灵活配置混合C,大成景禄灵活配置混合A,前海开源中国稀缺资产混合C,光大铭鑫混合A,西部利得中证500指数增强A,招商瑞庆混合A,富国中证医药主题指数增强A,嘉实文体娱乐股票C,广发创新升级混合,华宝券商ETF,前海开源中证大农业指数增强,光大动态优选混合,银河美丽混合A,博时裕益混合,嘉实文体娱乐股票A,招商丰益混合C,光大风格轮动混合A,光大产业新动力混合,景顺长城精选蓝筹混合,光大新增长混合,光大一带一路混合,中欧消费主题股票A,前海开源国家比较优势混合A,景顺长城优选混合,东方策略成长混合,兴业聚惠灵活配置混合A,鹏华增瑞混合(LOF),前海开源沪港深核心资源混合A,创金合信资源股票发起式C,招商丰益混合A,申万菱信安鑫优选混合A,信诚至裕灵活配置混合C,光大永鑫混合C,华夏移动互联混合美元现汇,光大诚鑫混合C,融通人工智能指数(LOF)A,交银医药创新股票A,银河行业混合,光大诚鑫混合A,前海联合国民健康混合A,广发多因子混合,九泰久兴灵活配置混合,广发鑫益混合,汇安丰利混合A,华泰柏瑞鼎利灵活配置混合A,宝盈新兴产业混合A,招商移动互联网产业股票基金,宝盈医疗健康沪港深股票,广发养老指数C,华夏移动互联混合人民币,华泰柏瑞鼎利灵活配置混合C,嘉实农业产业股票,西部利得新动力混合C,国泰国策驱动灵活配置混合A,国泰融信(LOF),国联安鑫安灵活配置混合,西部利得新动力混合A,申万菱信安鑫精选混合C,宝盈新锐混合A,华夏移动互联混合美元现钞,大成景润灵活配置混合,新华稳健回报混合发起式,大成景阳领先混合,申万菱信中证500指数优选增强A,招商国证生物医药指数(LOF)A,天弘中证证券保险C,广发新兴产业混合A,国泰中证申万证券行业指数,广发多元新兴股票,创金合信资源股票发起式A,信诚至诚灵活配置混合A,招商中小盘混合,嘉实沪港深回报混合,金鹰医疗健康产业A,中邮军民融合灵活配置混合,嘉实丰和灵活配置混合,申万菱信安鑫精选混合A,招商财经大数据股票A,华泰柏瑞量化创优混合,平安股息精选沪港深A,申万菱信安鑫优选混合C,浙商聚潮新思维混合,国泰策略价值灵活配置混合,嘉实优质企业混合,大成趋势回报灵活配置混合,广发策略优选混合,国投瑞银医疗保健混合A,光大中国制造2025混合,华宝事件驱动混合,华泰柏瑞价值增长混合A,招商行业精选股票基金,招商制造业混合C,平安股息精选沪港深C,九泰久盛量化先锋混合C,信诚至诚灵活配置混合B,华夏新锦升混合A,嘉实成长增强混合,新华优选消费混合,国泰大农业股票,景顺长城沪港深领先科技,广发稳健增长混合A,前海开源沪港深核心资源混合C,长信量化先锋混合A,富荣福锦混合A,光大先进服务业混合A,广发中证全指家用电器指数A,大成盛世精选灵活配置混合,光大创业板量化优选A,广发中证全指建筑材料指数C,泓德致远混合A,博时中证500指数增强A,大摩科技领先混合,广发睿毅领先混合A,国泰聚优价值灵活配置混合A,财通多策略福鑫定开混合,广发中证传媒ETF,广发资源优选股票A,前海联合泳隽混合A,富荣福锦混合C,鹏华优势企业,国泰智能汽车股票A,广发高端制造股票A,民生智造2025灵活配置混合,嘉实先进制造股票,华夏节能环保股票,财通多策略升级混合(LOF),国泰金泰灵活配置混合A,国泰融丰外延增长混合(LOF),金元顺安元启灵活配置混合,广发中证全指汽车指数A,金鹰中小盘精选混合,前海开源医疗健康A,海富通内需热点混合,平安医疗健康混合,嘉实医药健康股票C,国泰聚优价值灵活配置混合C,广发聚瑞混合A,金鹰医疗健康产业C,广发中证全指建筑材料指数A,天弘中证证券保险A,银华农业产业股票发起式A,广发中证基建工程ETF联接A,广发中证全指家用电器指数C,前海开源医疗健康C,中欧品质消费股票A,广发医疗保健股票A,国泰智能装备股票A,嘉实核心优势股票发起式,浙商全景消费混合A,泓德致远混合C,创金合信科技成长股票A,银华食品饮料量化股票发起式A,银华食品饮料量化股票发起式C,长信中证500指数增强A,招商稳健优选股票,中欧品质消费股票C,金鹰转型动力混合,华泰柏瑞生物医药混合A,万家经济新动能混合C,中信保诚新蓝筹混合,鹏华创新驱动混合,广发中证全指汽车指数C,广发中小盘精选混合A,长信价值蓝筹两年定开A,前海开源沪港深价值精选混合,诺安积极配置混合C,中银医疗保健混合A,嘉实医药健康股票A,广发科技动力股票,财通多策略福享混合(LOF),华泰柏瑞医疗健康A,工银医药健康股票A,创金合信新能源汽车股票A,诺安积极配置混合A,国泰价值精选灵活配置混合A,汇安丰利混合C,创金合信新能源汽车股票C,鹏华医疗保健股票,中银研究精选灵活配置混合A,九泰天富改革混合A,景顺长城新兴成长混合,泓德臻远回报混合,国泰睿吉灵活配置混合C,西部利得事件驱动股票,财通资管消费精选混合A,博时中证500指数增强C,金鹰核心资源混合,广发核心精选混合,嘉实量化精选股票,华夏产业升级混合,广发聚丰混合A,光大铭鑫混合C,长盛医疗行业量化配置股票,广发中证基建工程ETF联接C,嘉实瑞享定期混合,国泰国策驱动灵活配置混合C,工银医药健康股票C,广发优企精选混合A,万家经济新动能混合A,景顺长城鼎益混合(LOF),广发估值优势混合A,国泰成长优选混合,创金合信科技成长股票C,国泰景气行业灵活配置混合,兴业聚惠灵活配置混合C,大成精选增值混合,中银中国混合(LOF),新华行业灵活配置混合A,国泰金鹏蓝筹混合,国泰大健康股票A,国泰聚利价值定开混合,泰信蓝筹精选混合,信诚四季红混合,融通中国风1号灵活配置混合A/B,长信量化先锋混合C,华泰柏瑞新利混合A,大成创新成长混合(LOF),广发聚安混合A,广发创新驱动灵活配置混合,广发电子信息传媒股票A,诺安价值增长混合,博时裕隆灵活配置混合A,光大永鑫混合A,招商中证全指证券公司指数(LOF)A,华夏乐享健康混合,申万菱信中证申万医药生物指数(LOF),长信量化中小盘股票,大成中小盘混合(LOF)A,广发品牌消费股票发起式A,安信动态策略混合C,广发内需增长混合A,中信建投医改混合A,嘉实优化红利混合A,大成高新技术产业股票A,长信医疗保健混合(LOF)A,建信优选成长混合A,嘉实主题新动力混合,长信电子信息量化灵活配置混合A,天弘中证食品饮料ETF联接C,泰信竞争优选混合
广发沪深300ETF联接A,鹏华沪深300指数(LOF)A,华泰柏瑞沪深300ETF联接A,易方达沪深300发起式ETF,天治财富增长混合,长安沪深300非周期,华泰柏瑞沪深300ETF,长盛沪深300指数(LOF),大成沪深300指数A,国泰沪深300指数A,建信沪深300指数(LOF),南方沪深300ETF,农银沪深300指数A,前海开源沪深300指数,农银大盘蓝筹混合,天弘沪深300ETF联接A,长盛同庆中证800(LOF),华夏MSCIA股国际通ETF,易方达沪深300ETF联接A,华夏沪深300ETF联接A,中银沪深300等权重指数,广发沪深300ETF,华夏沪深300ETF,嘉实沪深300ETF联接A,嘉实沪深300ETF,国泰兴益灵活配置混合C,工银沪深300指数A,天弘中证800指数C,华润元大安鑫灵活配置混合A,泰达宏利量化股票,汇安丰恒灵活配置混合A,东吴沪深300指数A,诺安沪深300指数增强A,前海联合沪深300指数A,汇安丰恒灵活配置混合C,西部利得个股精选股票A,信诚沪深300指数(LOF)A,中科沃土沃鑫成长精选混合A,国金沪深300指数增强,泰达宏利业绩股票C,诺德量化蓝筹增强混合C,平安沪深300ETF,中金丰硕混合,鑫元鑫趋势灵活配置混合A,中科沃土沃嘉混合A,华泰紫金智能量化股票发起,汇添富沪深300指数A,平安沪深300指数量化A,诺德量化蓝筹增强混合A,中金金序量化蓝筹A,中金金序量化蓝筹C,中科沃土沃嘉混合C,诺德天富灵活配置混合,中航混改精选混合A,中航混改精选混合C,泰达宏利业绩股票A,鑫元鑫趋势灵活配置混合C,国寿安保沪深300ETF,东方互联网嘉混合,华泰MSCI中国A股国际通ETF,鑫元行业轮动混合C,国泰沪深300指数C,景顺MSCI中国A股ETF,易方达MSCI中国A股ETF,东吴沪深300指数C,鑫元行业轮动混合A,天弘中证800指数A,农银沪深300指数C,南方MSCI中国A股国际通ETF,国泰兴益灵活配置混合A,平安沪深300指数量化C,汇添富沪深300安中指数,泰信中证200指数,建信MSCI中国A股国际通ETF,汇添富沪深300指数C
华宝大盘精选混合,汇添富社会责任混合,海富通收益增长混合,长城中小盘成长混合,汇添富蓝筹稳健混合A,大成健康产业混合,富国天益价值混合A,富国天合稳健优选混合,富国天成红利混合,富国通胀通缩主题轮动混合,富国低碳环保混合,信达澳银红利回报混合,信达澳银产业升级混合,泰信先行策略混合,建信内生动力混合,长城安心回报混合,上投摩根大盘蓝筹股票,上投摩根成长先锋混合,中海量化策略混合,中海环保新能源混合,诺安创业板指数增强(LOF)A,长城品牌优选混合,长盛动态精选混合,汇添富均衡增长混合,建信核心精选混合,汇添富中证主要消费ETF,汇添富中证医药卫生ETF,富国高新技术产业混合,红塔红土盛世普益混合发起式,富国城镇发展股票,长城医疗保健混合,鹏华证券保险指数(LOF),建信中小盘先锋股票A,富国天盛灵活配置基金,汇添富环保行业股票,大摩资源优选混合(LOF),嘉实新消费股票,富国新兴产业股票,富国研究精选灵活配置混合,富国中小盘精选混合,前海开源新经济混合A,中欧成长优选混合A,富国新回报灵活配置混合C,建信积极配置混合,富国中证新能源汽车指数(LOF)A,建信健康民生混合,富国医疗保健行业混合A,长城环保主题混合,圆信永丰双利A,圆信永丰双利C,长城久富混合(LOF),中海医药健康产业精选混合A,汇添富外延增长股票A,汇添富移动互联股票,富国中证全指证券公司指数(LOF)A,鹏华中证一带一路主题指数(LOF),华宝医疗ETF联接A,汇添富医药保健混合A,鹏华酒A,富国新动力灵活配置混合C,中海能源策略混合,嘉实低价策略股票,富国宏观策略灵活配置混合A,英大领先回报混合发起式,长城改革红利混合,建信大安全战略精选股票,建信信息产业股票,汇添富医疗服务混合,富国新动力灵活配置混合A,鹏华中证环保产业指数(LOF),鹏华国证钢铁行业指数(LOF)A,汇添富国企创新股票,泰康新回报灵活配置混合A,金鹰民族新兴混合,富国高端制造行业股票,长盛中证全指证券指数(LOF),华夏蓝筹混合(LOF),新华鑫回报混合,富国创新科技混合A,大成360互联网+大数据100A,平安鑫安混合C,富国价值优势混合,招商安达灵活配置混合,景顺长城中小创精选股票,富国天瑞强势混合,广发沪港深新机遇股票,泰康新回报灵活配置混合C,泰康恒泰回报混合A,泰康恒泰回报混合C,汇添富沪港深新价值股票,泰康新机遇混合,富国低碳新经济混合A,平安鑫安混合A,上投摩根核心成长股票,富国美丽中国混合A,嘉实价值优势混合,天弘裕利灵活配置混合A,泰康宏泰回报混合,汇添富安鑫智选混合C,汇添富安鑫智选混合A,圆信永丰优加生活,中海优质成长混合,中海分红增利混合,富国中证智能汽车(LOF)A,泰康安泰回报混合,申万菱信中证申万证券行业指数,鹏华券商A,富国国家安全主题混合A,富国文体健康股票A,富国新收益灵活配置混合A,上投摩根双息平衡混合A,汇添富价值精选混合A,富国新收益灵活配置混合C,工银现代服务业混合,圆信永丰多策略,大成360互联网+大数据100C,西部利得祥运混合C,汇添富中证环境治理指数A,华宝稳健回报混合,广发鑫源混合C,广发鑫源混合A,汇添富中证中药指数(LOF)C,景顺中证500行业中性低波动,汇添富中证中药指数(LOF)A,富国中证体育产业指数(LOF)A,汇添富策略回报混合,华安中证全指证券公司指数,汇添富中证生物科技指数C,富国天源沪港深平衡混合,汇添富中证生物科技指数A,富国消费主题混合A,前海开源沪港深隆鑫混合A,前海开源沪港深隆鑫混合C,汇添富高端制造股票,上投摩根阿尔法混合,汇添富中证环境治理指数C,汇添富消费行业混合,东方睿鑫热点挖掘混合C,富国中证工业4.0指数(LOF)A,建信优势动力混合(LOF),长城消费增值混合,前海开源清洁能源混合A,汇添富全球互联混合,泰康兴泰回报沪港深混合,九泰鸿祥服务升级灵活配置混合,富国产业升级混合A,中邮中小盘灵活配置混合,前海开源清洁能源混合C,北信瑞丰产业升级,信达澳银健康中国混合,富国新活力灵活配置混合A,中海消费混合,长信先锐混合A,富国新活力灵活配置混合C,南方银行ETF联接A,汇添富年年泰定开混合A,汇添富民营新动力股票,大摩基础行业混合,富国改革动力混合,华安新动力灵活配置混合,西部利得新润混合,兴全合润混合(LOF),嘉实优势成长混合,南方军工改革灵活配置混合A,银华中证全指医药卫生,泰康均衡优选混合C,富国精准医疗混合,汇添富中证全指证券公司指数C,圆信永丰汇利混合(LOF),中海医疗保健主题股票,中融鑫价值混合C,上投摩根安隆回报C,博时厚泽回报混合A,富国沪港深行业精选混合A,富国新机遇灵活配置混合A,泰康景泰回报混合C,泰康景泰回报混合A,前海开源盛鑫混合C,嘉实价值精选股票,银河睿达灵活配置混合A,广发沪港深龙头混合,圆信永丰消费升级,汇添富中证全指证券公司指数A,汇添富成长焦点混合,博时厚泽回报混合C,中欧红利优享混合A,富国新机遇灵活配置混合C,富国研究量化精选混合,中欧成长优选混合E,平安量化精选混合C,圆信永丰双利优选,上投摩根安隆回报A,圆信永丰优享生活,银河睿达灵活配置混合C,中欧红利优享混合C,上投安裕回报A,长城智能产业灵活配置混合,富国军工主题混合A,泰康颐年混合C,汇添富创新医药混合,中融鑫价值混合A,富国臻选成长灵活配置混合,泰康颐享混合A,泰康颐享混合C,富国周期优势混合A,天弘裕利灵活配置混合C,富国转型机遇混合,西部利得祥运混合A,建信战略精选灵活配置混合A,东方红创新优选定开混合,长信稳进资产配置(FOF),圆信永丰优悦生活混合,泰康颐年混合A,富国价值驱动灵活配置混合A,东方睿鑫热点挖掘混合A,建信战略精选灵活配置混合C,招商大宗商品(LOF),汇添富文体娱乐混合,华夏养老2040(FOF),前海开源公用事业股票,汇添富中证新能源汽车A,富国价值驱动灵活配置混合C,汇添富中证新能源汽车C,富国天博创新主题混合,前海开源中证健康产业指数,上投安裕回报C,泰康策略优选混合,泰康弘实3月定开混合,建信龙头企业股票,富国新回报灵活配置混合A/B,汇添富价值创造定开混合,富国新趋势灵活配置混合A,中海医药健康产业精选混合C,建信创新中国混合,富国新趋势灵活配置混合C,泰康均衡优选混合A,鹏华中证800地产指数(LOF),富国沪港深价值混合A,工银中证传媒指数(LOF)A,中融国证钢铁行业指数(LOF),鹏华中证传媒指数(LOF),长城久嘉创新成长混合A,前海开源盛鑫混合A,泰康沪港深精选混合,汇添富年年泰定开混合C,汇添富中证主要消费ETF联接A,建信鑫安回报灵活配置混合,平安量化精选混合A
